{
    "$schema": "http://json-schema.org/draft-07/schema#",
    "$id": "http://cweiske.de/ouya-game.schema.json",
    "title": "OUYA game metadata",
    "description": "Game data importable in OUYA API servers.",
    "type": "object",

    "required": [
        "packageName",
        "title",
        "releases",
        "discover",
        "media",
        "developer"
    ],
    "additionalProperties": false,
    "properties": {
        "packageName": {
            "description": "Java package names",
            "type": "string",
            "examples": [
                "com.vendor.gamename"
            ]
        },

        "title": {
            "description": "Game name",
            "type": "string"
        },

        "description": {
            "description": "Text describing the game. Newlines (CRLF) allowed",
            "type": "string"
        },

        "blockedInWebText": {
            "description": "Text describing why the game data are not visible in the web",
            "type": "string"
        },

        "players": {
            "description": "How many players can play this game at the same time?",
            "type": "array",
            "items": {
                "type": "number",
                "minimum": 1
            }
        },

        "genres": {
            "description": "Categories",
            "type": "array",
            "items": {
                "type": "string",
                "uniqueItems": true,
                "enum": [
                    "Adventure",
                    "App",
                    "Arcade/Pinball",
                    "Card/Casino",
                    "Dual Stick",
                    "Entertainment",
                    "Exclusive",
                    "Fight!",
                    "FPS/Shooter",
                    "Kids List",
                    "Meditative",
                    "Multiplayer",
                    "Music",
                    "Platformer",
                    "Puzzle/Trivia",
                    "Racing",
                    "Retro",
                    "Role-Playing",
                    "Short on Time?",
                    "Sim/Strategy",
                    "Sports",
                    "Utility",
                    "Video",
                    "VIP Room",

                    "Emulator",
                    "2019 GameJam",
                    "2020 GameJam",
                    "2020 Winter GameJam",
                    "2021 Anniversary GameJam",
                    "2021 Winter GameJam",
                    "2022 Winter GameJam",
                    "2023 Anniversary GameJam",
                    "2024 Anniversary GameJam",
                    "2025 Winter GameJam",

                    "Launcher",
                    "Open Source",
                    "PlayJam GameStick",
                    "Repackaged",
                    "Tutorials",
                    "Unlocked"
                ]
            }
        },

        "languages": {
            "description": "Language of text/audio content (ISO 639-1)",
            "type": "array",
            "items": {
                "type": "string",
                "uniqueItems": true,
                "enum": [
                    "cs",
                    "da",
                    "de",
                    "el",
                    "en",
                    "eo",
                    "es",
                    "fi",
                    "fr",
                    "hu",
                    "it",
                    "ja",
                    "ko",
                    "nl",
                    "no",
                    "pl",
                    "pt",
                    "ru",
                    "sr",
                    "sv",
                    "th",
                    "tk",
                    "uk",
                    "zh"
                ]
            }
        },

        "releases": {
            "type": "array",
            "items": {
                "type": "object",
                "required": [
                    "name",
                    "versionCode",
                    "uuid",
                    "date",
                    "url",
                    "size",
                    "md5sum"
                ],
                "additionalProperties": false,
                "properties": {

                    "broken": {
                        "description": "If the download URL does not work anymore",
                        "type": "boolean",
                        "default": false
                    },

                    "name": {
                        "description": "Human readable version number",
                        "type": "string",
                        "examples": [
                            "1.6"
                        ]
                    },

                    "versionCode": {
                        "description": "APK-internal version code. Run \"aapt dump badging file.apk\", field \"versionCode\"",
                        "type": ["number", "null"]
                    },

                    "uuid": {
                        "description": "Unique ID for the release. Use uuid-gen to get one",
                        "type": "string"
                    },

                    "date": {
                        "description": "When the version has been released",
                        "type": "string",
                        "format": "date|datetime"
                    },

                    "url": {
                        "description": ".apk download link",
                        "type": "string",
                        "format": "url",
                        "pattern": "^(?!https://.*\\.cweiske\\.de)"
                    },

                    "size": {
                        "description": "File size in bytes",
                        "type": "number",
                        "minimum": 1
                    },

                    "md5sum": {
                        "description": "MD5 hash of the .apk file contents",
                        "type": ["string", "null"],
                        "default": null
                    },

                    "publicSize": {
                        "description": "FIXME",
                        "type": "number"
                    },

                    "nativeSize": {
                        "description": "FIXME",
                        "type": "number"
                    },

                    "cert_fingerprint": {
                        "description": "A SHA256 format fingerprint of the signing certificate that was used for this APK. Allows for authorization tracking.",
                        "type": "string",
                        "minLength": 95,
                        "maxLength": 95,
                        "pattern": "^([0-9A-F]{2}:){31}[0-9A-F]{2}$",
                        "examples": [
                            "EF:D5:B9:C0:58:C1:21:ED:97:F3:FD:89:21:12:B6:00:F6:D1:9B:C2:9B:EE:F7:47:40:0C:E0:BB:0D:25:1C:40"
                        ]
                    },

                    "cert_subject": {
                        "description": "The subject name of the signing certificate",
                        "type": "string",
                        "examples": [
                            "C = US, O = Android, CN = Android Debug",
                            "C = US, ST = CA, L = San Francisco, O = SEGA of America, OU = Mobile PD, CN = alben pedroso"
                        ]
                    },

                    "stability": {
                        "description": "What quality of a release this is",
                        "default": "stability",
                        "type": "string",
                        "enum": [
                            "alpha",
                            "beta",
                            "stable"
                        ]
                    }
                }
            }
        },

        "discover": {
            "description": "Main game image. Used in the OUYA discover store. Size 732x412",
            "type": "string",
            "format": "url",
            "pattern": "^(?!https://.*\\.cweiske\\.de)"
        },

        "media": {
            "description": "Images and videos for the details and apps pages. Can be in any order. The first video is used for the app's 'video' field, all images for app's 'screenshots'. Images are sized 1280x720",
            "type": "array",
            "items": {
                "type": "object",
                "required": [
                    "type",
                    "url"
                ],
                "additionalProperties": false,
                "properties": {
                    "type": {
                        "description": "Medium type: image or video",
                        "type": "string",
                        "enum": [
                            "image",
                            "video"
                        ]
                    },
                    "url": {
                        "description": "Image URL or video URL. Vimeo and Youtube URLs supported",
                        "type": "string",
                        "format": "url",
                        "pattern": "^(?!https://.*\\.cweiske\\.de)"
                    },
                    "thumb": {
                        "description": "Small preview image. Size should be 852x479.",
                        "type": "string",
                        "format": "url",
                        "pattern": "^(?!https://.*\\.cweiske\\.de)"
                    }
                }
            }
        },

        "developer": {
            "type": "object",
            "required": [
                "name"
            ],
            "additionalProperties": false,
            "properties": {

                "uuid": {
                    "description": "Unique ID for the developer",
                    "type": ["string", "null"],
                    "default": null
                },

                "name": {
                    "description": "Developer (company or person) name",
                    "type": "string"
                },

                "supportEmail": {
                    "description": "E-Mail address for support questions",
                    "type": ["string", "null"],
                    "format": "email",
                    "default": null
                },

                "alternateEmail": {
                    "description": "Alternate E-Mail address for support questions",
                    "type": ["string", "null"],
                    "format": "email",
                    "default": null
                },

                "website": {
                    "description": "Developer website",
                    "type": ["string", "null"],
                    "format": "url",
                    "default": null
                },

                "supportPhone": {
                    "description": "Telephone number",
                    "type": ["string", "null"],
                    "default": null
                },

                "founder": {
                    "description": "If the developer was an OUYA founder",
                    "type": "boolean",
                    "default": false
                }
            }
        },

        "contentRating": {
            "description": "Which audience is this game for?",
            "type": "string",
            "enum": [
                "Everyone",
                "9+",
                "12+",
                "17+"
            ]
        },

        "website": {
            "description": "Game website",
            "type": ["string", "null"],
            "format": "url"
        },

        "firstPublishedAt": {
            "description": "When the game has first been published to the world",
            "type": ["string", "null"],
            "format": "date|date-time",
            "default": null
        },

        "inAppPurchases": {
            "description": "If you can buy things in the game",
            "type": "boolean",
            "default": false
        },

        "overview": {
            "description": "FIXME",
            "type": ["string", "null"],
            "default": null
        },

        "premium": {
            "description": "The game has no demo but has to be bought before playing it",
            "type": "boolean",
            "default": false
        },

        "rating": {
            "type": "object",
            "additionalProperties": false,
            "properties": {

                "likeCount": {
                    "description": "Number of likes this game has",
                    "type": "number",
                    "minimum": 0,
                    "default": 0
                },

                "average": {
                    "description": "Average rating for this game",
                    "type": "number",
                    "minimum": 0,
                    "maximum": 5,
                    "default": 0
                },

                "count": {
                    "description": "Number of ratings",
                    "type": "number",
                    "minimum": 0,
                    "default": 0
                }
            }
        },

        "products": {
            "description": "Items that could be bought via the discover store",
            "type": "array",
            "items": {
                "type": "object",
                "required": [
                    "identifier",
                    "name",
                    "localPrice",
                    "originalPrice",
                    "currency"
                ],
                "additionalProperties": false,
                "properties": {

                    "promoted": {
                        "description": "If this product is visible in the ouya discover store",
                        "type": "boolean"
                    },

                    "type": {
                        "description": "Kind of product",
                        "type": "string",
                        "enum": ["entitlement", "consumable", "subscription"],
                        "default": "entitlement"
                    },

                    "identifier": {
                        "description": "Internal key",
                        "type": "string",
                        "examples": [
                            "full_version"
                        ]
                    },

                    "name": {
                        "description": "Human readable name",
                        "type": "string",
                        "examples": [
                            "Unlock full game"
                        ]
                    },

                    "description": {
                        "description": "Explanation of the features you will buy",
                        "type": ["string", "null"],
                        "default": null
                    },

                    "localPrice": {
                        "description": "Current price (maybe discounted)",
                        "type": "number"
                    },

                    "originalPrice": {
                        "description": "Previous price",
                        "type": "number"
                    },

                    "currency": {
                        "description": "Three-letter currency code, depending on the player that was logged in",
                        "type": "string",
                        "enum": ["EUR", "USD"]
                    }
                }
            }
        },

        "relationships": {
            "type": "object",
            "description": "Links to other OUYA applications",
            "additionalProperties": false,
            "properties": {
                "fixed": {
                    "type": "string",
                    "description": "Package name of fixed application (if this here has a bug)"
                },
                "launcher": {
                    "type": "string",
                    "description": "Package name of app that starts this one (for PlayJam GameStick games)"
                },
                "unlocked": {
                    "type": "string",
                    "description": "Package name of unlocked application (full version if this is the demo)"
                },
                "original": {
                    "type": "string",
                    "description": "Package name of original application (demo version if this is the unlocked version, unmodified GameStick game if this is the launcher)"
                }
            }
        },

        "notes": {
            "description": "Technical notes on the game, e.g. how to get it working or which controllers work.",
            "type": "string"
        }
    }
}
