{
    "packageName": "com.keeplay.december21st",
    "title": "December 21st",
    "description": "Save the world solving enigmatic Mayan puzzles in this challenging Sokoban style game!\r\n\r\nA long time ago, somewhere in the continent of America...\r\n\r\nThe Mayans discovered that a meteor was going to collide with the Earth on December 21st, 2012.\r\nHaving predicted the end of the world on that day, they have developed a way to destroy the meteor hours before the collision, when the meteor was within reach of their invention.\r\nTherefore, a powerful shaman offered himself to be petrified and awake one day before the end of the world, when he would activate the device to destroy the meteor....\r\n\r\nThat day has come, our hero has got 24 hours to save the world...\r\n\r\nFEATURES\r\n\r\n* 100 Increasingly Difficult Levels\r\n* Many Hours Of Gameplay\r\n* Levels auto-resolution\r\n* An Undo Button to Undo Your Last Move",
    "players": [
        1
    ],
    "genres": [
        "Kids List",
        "Puzzle/Trivia"
    ],
    "releases": [
        {
            "name": "1.0.1",
            "versionCode": 0,
            "uuid": "7473965b-0bf3-44a7-8572-9400a30a2b41",
            "date": "2013-09-25T11:37:16Z",
            "url": "https://archive.org/download/ouya_com.keeplay.december21st_1.0.1/December%2021st_1.0.1_com.keeplay.december21st.apk",
            "size": 55562844,
            "md5sum": null,
            "publicSize": 0,
            "nativeSize": 0
        }
    ],
    "discover": "http://ouya.cweiske.de/game-images/com.keeplay.december21st/discover",
    "media": [
        {
            "type": "image",
            "url": "http://ouya.cweiske.de/game-images/com.keeplay.december21st/screenshot-1",
            "thumb": "http://ouya.cweiske.de/game-images/com.keeplay.december21st/screenshot-1-thumb"
        },
        {
            "type": "image",
            "url": "http://ouya.cweiske.de/game-images/com.keeplay.december21st/screenshot-2",
            "thumb": "http://ouya.cweiske.de/game-images/com.keeplay.december21st/screenshot-2-thumb"
        },
        {
            "type": "image",
            "url": "http://ouya.cweiske.de/game-images/com.keeplay.december21st/screenshot-3",
            "thumb": "http://ouya.cweiske.de/game-images/com.keeplay.december21st/screenshot-3-thumb"
        },
        {
            "type": "image",
            "url": "http://ouya.cweiske.de/game-images/com.keeplay.december21st/screenshot-4",
            "thumb": "http://ouya.cweiske.de/game-images/com.keeplay.december21st/screenshot-4-thumb"
        },
        {
            "type": "image",
            "url": "http://ouya.cweiske.de/game-images/com.keeplay.december21st/screenshot-5",
            "thumb": "http://ouya.cweiske.de/game-images/com.keeplay.december21st/screenshot-5-thumb"
        }
    ],
    "developer": {
        "uuid": "00000000-9fae-4885-9667-481a91244fb4",
        "name": "Keeplay Game Studios",
        "supportEmail": "development@keeplay.com",
        "supportPhone": null,
        "founder": false
    },
    "contentRating": "Everyone",
    "website": "http://www.keeplay.com",
    "firstPublishedAt": "2013-09-22T03:15:28Z",
    "inAppPurchases": true,
    "overview": "Released in September 2013 by Keeplay Game Studios.",
    "premium": false,
    "rating": {
        "likeCount": 25,
        "average": 3.28,
        "count": 29
    }
}
