{
    "packageName": "air.com.impulse12.XP1728",
    "title": "XP1728",
    "description": "An addictive puzzle game, directly inspired by SCE's original Intelligent Qube (aka Kurushi Final in Europe), the great PlayStation hit!",
    "players": [
        1
    ],
    "genres": [
        "Puzzle/Trivia"
    ],
    "releases": [
        {
            "name": "1.3.8",
            "versionCode": 0,
            "uuid": "66ef6cf1-7383-40eb-9989-f5420cd631d0",
            "date": "2013-06-26T21:15:48Z",
            "url": "https://archive.org/download/ouya_air.com.impulse12.XP1728_1.3.8/XP1728_1.3.8_air.com.impulse12.XP1728.apk",
            "size": 47487539,
            "md5sum": null,
            "publicSize": 0,
            "nativeSize": 0
        }
    ],
    "discover": "http://ouya.cweiske.de/game-images/air.com.impulse12.XP1728/discover",
    "media": [
        {
            "type": "image",
            "url": "https://archive.org/download/ouya_air.com.impulse12.XP1728_1.3.8/tCgqGnUYRk2qP093xnar.jpg",
            "thumb": "https://archive.org/download/ouya_air.com.impulse12.XP1728_1.3.8/tCgqGnUYRk2qP093xnar_thumb.jpg"
        },
        {
            "type": "image",
            "url": "https://archive.org/download/ouya_air.com.impulse12.XP1728_1.3.8/BwjZBsrLSPNtyGspigbW.jpg",
            "thumb": "https://archive.org/download/ouya_air.com.impulse12.XP1728_1.3.8/BwjZBsrLSPNtyGspigbW_thumb.jpg"
        },
        {
            "type": "image",
            "url": "https://archive.org/download/ouya_air.com.impulse12.XP1728_1.3.8/pc2yCFrQQay431ibeaxh.jpg",
            "thumb": "https://archive.org/download/ouya_air.com.impulse12.XP1728_1.3.8/pc2yCFrQQay431ibeaxh_thumb.jpg"
        },
        {
            "type": "image",
            "url": "https://archive.org/download/ouya_air.com.impulse12.XP1728_1.3.8/jMhCrtPDQ3SIuiNYrd8B.jpg",
            "thumb": "https://archive.org/download/ouya_air.com.impulse12.XP1728_1.3.8/jMhCrtPDQ3SIuiNYrd8B_thumb.jpg"
        }
    ],
    "developer": {
        "uuid": null,
        "name": "impulse12",
        "supportEmail": "contact@impulse12.com",
        "supportPhone": null,
        "founder": true
    },
    "contentRating": "Everyone",
    "website": "www.impulse12.com",
    "firstPublishedAt": "2013-06-26T21:15:48Z",
    "inAppPurchases": true,
    "overview": "Released in June 2013 by impulse12.",
    "premium": false,
    "rating": {
        "likeCount": 77,
        "average": 3.06,
        "count": 35
    }
}
