{
    "packageName": "dk.MoonWalkers.indiejam2014",
    "title": "Alien Resource Battle",
    "description": "Aliens are invading Earth and battles each other for resources like nuclear waste and industrial burgers.\n\nUpdate:\nUpdated the game to a newer version of Unity and added better explosions for the dynamite boxes that push boxes around it away.",
    "players": [
        2
    ],
    "genres": [
        "Arcade/Pinball",
        "Multiplayer"
    ],
    "releases": [
        {
            "name": "1.2",
            "versionCode": 1,
            "uuid": "20a9ad29-5105-481d-b89c-7b5a8c43ee65",
            "date": "2016-01-28T10:08:43Z",
            "url": "https://archive.org/download/ouya_dk.MoonWalkers.indiejam2014_1.2/Alien%20Resource%20Battle_1.2_dk.MoonWalkers.indiejam2014.apk",
            "size": 36534110,
            "md5sum": "62f1dcf48da082afeba7636fa3a0f4ea",
            "publicSize": 151250,
            "nativeSize": 19242100
        }
    ],
    "discover": "http://ouya.cweiske.de/game-images/dk.MoonWalkers.indiejam2014/discover",
    "media": [
        {
            "type": "image",
            "url": "http://ouya.cweiske.de/game-images/dk.MoonWalkers.indiejam2014/detail-1",
            "thumb": "http://ouya.cweiske.de/game-images/dk.MoonWalkers.indiejam2014/detail-1-thumb"
        },
        {
            "type": "image",
            "url": "http://ouya.cweiske.de/game-images/dk.MoonWalkers.indiejam2014/detail-2",
            "thumb": "http://ouya.cweiske.de/game-images/dk.MoonWalkers.indiejam2014/detail-2-thumb"
        },
        {
            "type": "image",
            "url": "http://ouya.cweiske.de/game-images/dk.MoonWalkers.indiejam2014/detail-3",
            "thumb": "http://ouya.cweiske.de/game-images/dk.MoonWalkers.indiejam2014/detail-3-thumb"
        }
    ],
    "developer": {
        "uuid": "00000000-2126-4bbc-8dd2-94eb25f00382",
        "name": "Dionysus.dk",
        "supportEmail": "kaspersolesen@gmail.com",
        "supportPhone": null,
        "founder": true
    },
    "contentRating": "Everyone",
    "website": "dionysus.dk",
    "firstPublishedAt": "2014-08-14T21:16:13Z",
    "inAppPurchases": false,
    "overview": "Released in January 2016 by Dionysus.dk.",
    "premium": false,
    "rating": {
        "likeCount": 0,
        "average": 2.41,
        "count": 54
    }
}
