{
    "packageName": "com.jackboxgames.JackboxPartyLoaderFull",
    "title": "The Jackbox Party Pack",
    "description": "For 1-100 players! Your phones or tablets are your controllers! The team behind YOU DON’T KNOW JACK presents FIVE guffaw-inducing party games in one pack! Games include: \n 1) The comedy trivia sensation YOU DON’T NOW JACK 2015 (1-4 players) with hundreds of all-new questions. \n 2) The hilarious bluffing game Fibbage XL (2-8 players), with 50% more questions added to the original hit game Fibbage. \n 3) The bizarre drawing game Drawful (3-8 players) - you draw right there on your phone or tablet (very little/no real skill required). \n 4) The racy-as-you-want-to-be fill-in-the-blank word game Word Spud (2-8 players). \n 5) The wacky-fact-filled Lie Swatter (1-100 players). \n\nPlayers play using their phones, tablets, or even computers as controllers – making it the perfect easy-in entertainment piece for your next game night or party. Once a game is started from the in-pack menu, players simply connect to the “jackbox.tv” web address on their device and then enter the on-screen room code to enter a game. No big mess of controllers needed! You’re gonna need more than one party for this. \n\nNote: The games included in this pack are in English only & are local multiplayer only.",
    "players": [
        1
    ],
    "genres": [
        "Multiplayer",
        "Puzzle/Trivia"
    ],
    "releases": [
        {
            "name": "1.0.6",
            "versionCode": 0,
            "uuid": "9f7e7574-c6d9-4537-94ee-c277fe373e3f",
            "date": "2017-04-11T22:58:59Z",
            "url": "https://archive.org/download/ouya_com.jackboxgames.JackboxPartyLoaderFull_1.0.6/The%20Jackbox%20Party%20Pack_1.0.6_com.jackboxgames.JackboxPartyLoaderFull.apk",
            "size": 552550272,
            "md5sum": "f26304c0507c72d31625713a3d6bd7e5",
            "publicSize": 192121932,
            "nativeSize": 8939328
        }
    ],
    "discover": "http://ouya.cweiske.de/game-images/com.jackboxgames.JackboxPartyLoaderFull/discover",
    "media": [
        {
            "type": "video",
            "url": "https://vimeo.com/117508130"
        },
        {
            "type": "image",
            "url": "http://ouya.cweiske.de/game-images/com.jackboxgames.JackboxPartyLoaderFull/detail-1",
            "thumb": "http://ouya.cweiske.de/game-images/com.jackboxgames.JackboxPartyLoaderFull/detail-1-thumb"
        },
        {
            "type": "image",
            "url": "http://ouya.cweiske.de/game-images/com.jackboxgames.JackboxPartyLoaderFull/detail-2",
            "thumb": "http://ouya.cweiske.de/game-images/com.jackboxgames.JackboxPartyLoaderFull/detail-2-thumb"
        },
        {
            "type": "image",
            "url": "http://ouya.cweiske.de/game-images/com.jackboxgames.JackboxPartyLoaderFull/detail-3",
            "thumb": "http://ouya.cweiske.de/game-images/com.jackboxgames.JackboxPartyLoaderFull/detail-3-thumb"
        },
        {
            "type": "image",
            "url": "http://ouya.cweiske.de/game-images/com.jackboxgames.JackboxPartyLoaderFull/detail-4",
            "thumb": "http://ouya.cweiske.de/game-images/com.jackboxgames.JackboxPartyLoaderFull/detail-4-thumb"
        },
        {
            "type": "image",
            "url": "http://ouya.cweiske.de/game-images/com.jackboxgames.JackboxPartyLoaderFull/detail-5",
            "thumb": "http://ouya.cweiske.de/game-images/com.jackboxgames.JackboxPartyLoaderFull/detail-5-thumb"
        },
        {
            "type": "image",
            "url": "http://ouya.cweiske.de/game-images/com.jackboxgames.JackboxPartyLoaderFull/detail-6",
            "thumb": "http://ouya.cweiske.de/game-images/com.jackboxgames.JackboxPartyLoaderFull/detail-6-thumb"
        },
        {
            "type": "image",
            "url": "http://ouya.cweiske.de/game-images/com.jackboxgames.JackboxPartyLoaderFull/detail-7",
            "thumb": "http://ouya.cweiske.de/game-images/com.jackboxgames.JackboxPartyLoaderFull/detail-7-thumb"
        },
        {
            "type": "image",
            "url": "http://ouya.cweiske.de/game-images/com.jackboxgames.JackboxPartyLoaderFull/detail-8",
            "thumb": "http://ouya.cweiske.de/game-images/com.jackboxgames.JackboxPartyLoaderFull/detail-8-thumb"
        }
    ],
    "developer": {
        "uuid": null,
        "name": "Jackbox Games, Inc",
        "supportEmail": null,
        "supportPhone": null,
        "founder": false
    },
    "contentRating": "12+",
    "website": "www.jackboxgames.com",
    "firstPublishedAt": "2015-02-10T03:12:28Z",
    "inAppPurchases": false,
    "overview": "Released in April 2017 by Jackbox Games, Inc.",
    "premium": true,
    "rating": {
        "likeCount": 0,
        "average": 4.77,
        "count": 60
    },
    "products": [
        {
            "promoted": true,
            "identifier": "JackBoxPartyPack_License_Full_Upgrade",
            "name": "The Jackbox Party Pack",
            "description": "Includes all 5 games!",
            "localPrice": 24.99,
            "originalPrice": 24.99,
            "currency": "USD"
        }
    ]
}
