{
    "packageName": "com.epsilonstudios.FarrahRogueZH",
    "title": "Farrah Rogue - Zero Hour",
    "description": "Farrah Rogue is a fast paced FPS couch multiplayer game. Get your friends together and kick some butt! This is still a Developer preview, there are rough edges. Weâ€™re working hard on new features and content. Please support us by joining our facebook page, and commenting on our ouyaforum.com thread. Thanks!\r\n\r\n-4 levels\r\n-Deathmatch (2-4 players)\r\n-Break the targets (single player)\r\n-Ship deathmatch (2-4players) **Developer preview**",
    "players": [
        1
    ],
    "genres": [
        "FPS/Shooter",
        "Multiplayer"
    ],
    "releases": [
        {
            "name": "1.0",
            "versionCode": 0,
            "uuid": "ba6c711e-a5f5-4fad-abac-c8fcbcd9d2c3",
            "date": "2014-06-26T21:27:10Z",
            "url": "https://archive.org/download/ouya_com.epsilonstudios.FarrahRogueZH_1.0/Farrah%20Rogue%20-%20Zero%20Hour_1.0_com.epsilonstudios.FarrahRogueZH.apk",
            "size": 217399240,
            "md5sum": "207bab01dffb229683f1ac45767e02a2",
            "publicSize": 460784,
            "nativeSize": 195984
        }
    ],
    "discover": "http://ouya.cweiske.de/game-images/com.epsilonstudios.FarrahRogueZH/discover",
    "media": [
        {
            "type": "video",
            "url": "https://vimeo.com/99194248"
        },
        {
            "type": "image",
            "url": "http://ouya.cweiske.de/game-images/com.epsilonstudios.FarrahRogueZH/detail-1",
            "thumb": "http://ouya.cweiske.de/game-images/com.epsilonstudios.FarrahRogueZH/detail-1-thumb"
        },
        {
            "type": "image",
            "url": "http://ouya.cweiske.de/game-images/com.epsilonstudios.FarrahRogueZH/detail-2",
            "thumb": "http://ouya.cweiske.de/game-images/com.epsilonstudios.FarrahRogueZH/detail-2-thumb"
        },
        {
            "type": "image",
            "url": "http://ouya.cweiske.de/game-images/com.epsilonstudios.FarrahRogueZH/detail-3",
            "thumb": "http://ouya.cweiske.de/game-images/com.epsilonstudios.FarrahRogueZH/detail-3-thumb"
        },
        {
            "type": "image",
            "url": "http://ouya.cweiske.de/game-images/com.epsilonstudios.FarrahRogueZH/detail-4",
            "thumb": "http://ouya.cweiske.de/game-images/com.epsilonstudios.FarrahRogueZH/detail-4-thumb"
        }
    ],
    "developer": {
        "uuid": null,
        "name": "Epsilon Studios",
        "supportEmail": "jguard@epsilonstudios.com",
        "supportPhone": null,
        "founder": false
    },
    "contentRating": "9+",
    "website": "www.epsilonstudios.com",
    "firstPublishedAt": "2014-05-27T07:11:24Z",
    "inAppPurchases": false,
    "overview": "Released in June 2014 by Epsilon Studios.",
    "premium": false,
    "rating": {
        "likeCount": 0,
        "average": 3.89,
        "count": 308
    }
}
